"4";"Frappe assommante";"Évocation du 4e niveau";"1 action bonus";"personnelle";"V";"(C) 1 minute";"La première fois que vous touchez une créature avec une attaque d’arme de corps à corps avant que le sort prenne fin, votre arme atteint également l’esprit de votre cible, qui subit 4d6 dégâts psychiques supplémentaires. La cible doit également réussir un JS Sagesse, sous peine de subir un désavantage à ses jets d’attaque et ses tests de caractéristique, et de ne pas pouvoir jouer de réaction, jusqu’à la fin de son tour de jeu suivant.";"Paladin"
"4";"Localiser une créature";"Divination du 4e niveau";"1 action";"personnelle";"V, G, M ";"(C) 1 heure";"(un peu de fourrure de limier) Décrivez ou nommez une créature qui vous est familière. Vous découvrez la direction dans laquelle se trouve la cible, tant qu’elle se situe dans un rayon de 300 m de vous. Si elle se déplace, vous savez dans quelle direction elle progresse. <br> Ce sort permet de localiser une créature précise que vous connaissez, ou une créature d’un genre spécifique (comme un humain ou une licorne), sous réserve que vous ayez déjà vu ce type de créature de près (dans un rayon de 9 m) au moins une fois. Si la créature décrite ou nommée a adopté une forme différente (sous l’effet du sort <i>métamorphose</i> par exemple), cette divination ne permet pas de la localiser. <br> En outre, ce sort ne permet pas de localiser une créature si un cours d’eau d’au moins 3 m de large coupe le chemin direct qui vous sépare d’elle.";"Paladin"
"4";"Protection contre la mort";"Abjuration du 4e niveau";"1 action";"contact";"V, G";"8 heures";"Vous touchez une créature et lui conférez une protection limitée contre la mort. <br> La première fois que la cible est censée tomber à 0 point de vie après avoir subi des dégâts, elle tombe simplement à 1 point de vie et le sort prend fin. <br> Si le sort persiste alors que la cible est victime d’un effet censé la tuer instantanément sans lui infliger de dégâts, l’effet en question est annulé contre la cible et le sort prend fin.";"Paladin"
"5";"Cercle de pouvoir";"Abjuration du 5e niveau";"1 action";"personnelle (rayon de 9 m)";"V";"(C) 10 minutes";"Une force divine émane de vous, déployant des énergies agitées dans un rayon de 9 m. La sphère se déplace avec vous tant que le sort persiste, et vous en restez le centre. Jusqu’à la fin du sort, toute créature amicale comprise dans la zone (y compris vous) bénéficie d’un avantage aux jets de sauvegarde contre les sorts et autres effets magiques. En outre, lorsqu’une telle créature réussit un jet de sauvegarde contre un sort ou effet magique lui permettant de réduire les dégâts de moitié en cas de sauvegarde réussie, elle ne subit en fait aucun dégât si elle réussit son JS.";"Paladin"
"5";"Coercition mystique";"Enchantement du 5e niveau";"1 minute";"18 m";"V";"30 jours";"Vous placez une injonction magique sur une créature que vous voyez à portée. Vous l’obligez à entreprendre une mission ou, à l’inverse, à s’en détourner. Si la créature est en mesure de vous comprendre, elle doit réussir un JS Sagesse sous peine d’être charmée par vos soins pour toute la durée du sort. Tant qu’elle est charmée de la sorte, elle subit 5d10 dégâts psychiques chaque fois qu’elle va directement à l’encontre de vos instructions, mais une fois par jour seulement. Une créature qui ne vous comprend pas n’est pas affectée par ce sort. <br> Vous pouvez donner n’importe quel ordre, pour peu que cela n’entraîne pas la mort assurée de la cible. Si vous lui donnez un ordre suicidaire, le sort prend fin. <br> Vous pouvez mettre fin à ce sort prématurément au prix d’une action. Il est alors révoqué. Les sorts <i>délivrance des malédictions</i>, <i>restauration suprême</i> et <i>souhait</i> y mettent également fin. <br> <i><b>À plus hauts niveaux.</b></i> Quand vous jetez ce sort en utilisant un emplacement de sort du 7e ou du 8e niveau, la durée est de 1 an. Quand vous jetez ce sort en utilisant un emplacement de sort du 9e niveau, le sort persiste jusqu’à ce qu’un des sorts mentionnés ci-dessus y mette fin.";"Paladin"
"5";"Dissipation du mal et du bien";"Abjuration du 5e niveau";"1 action";"personnelle";"V, G, M ";"(C) 1 minute";"(de l’eau bénite ou de la poudre de fer et d’argent) Une énergie scintillante épouse votre silhouette et vous protège des fées, morts-vivants et créatures non originaires du Plan Matériel. Pour toute la durée du sort, les célestes, élémentaires, fées, fiélons et morts-vivants subissent un désavantage aux jets d’attaque contre vous. <br> Vous pouvez mettre fin au sort prématurément en utilisant une des fonctions spéciales qui suivent. <br> <i><b>Briser un enchantement.</b></i> Au prix d’une action, vous touchez une créature à portée d’allonge qui est charmée, effrayée ou possédée par un céleste, un élémentaire, une fée, un fiélon ou un mort-vivant. La cible touchée n’est plus charmée, effrayée ou possédée par la créature en question. <br> <i><b>Renvoi.</b></i> Au prix d’une action, effectuez une attaque de sort au corps à corps contre un céleste, un élémentaire, une fée, un fiélon ou un mort-vivant à portée d’allonge. En cas de réussite, vous tentez de chasser la créature vers son plan d’origine. Elle doit réussir un JS Charisme sous peine d’être renvoyée sur son plan d’origine – si elle n’y est pas déjà. S’ils ne sont pas sur leur plan d’origine, les morts-vivants sont chassés vers Gisombre et les fées vers Féerie.";"Paladin"
"5";"Frappe du bannissement";"Abjuration du 5e niveau";"1 action bonus";"personnelle";"V";"(C) 1 minute";"La première fois que vous touchez une créature avec une attaque d’arme avant la fin de ce sort, votre arme crépitera d’énergie, infligeant 5d10 dégâts de force à la cible. En outre, si cette attaque fait tomber la cible à 50 points de vie ou moins, vous la bannissez. Si la cible est originaire d’un autre plan d’existence que celui sur lequel vous vous trouvez, elle disparaît pour le rejoindre. Si vous êtes au contraire sur son plan d’origine, elle est bannie vers un demi-plan inerte dans lequel elle se retrouve neutralisée. Elle y reste jusqu’à la fin du sort, après quoi elle réapparaît dans l’espace qu’elle occupait ou dans l’espace le plus proche si la place n’est plus libre.";"Paladin"
"5";"Relever les morts";"Nécromancie du 5e niveau";"1 heure";"contact";"V, G, M ";"instantanée";"(un diamant d’une valeur minimale de 500 po, que le sort détruit) Vous rendez la vie à une créature morte que vous touchez pourvu que sa mort ne remonte pas à plus de 10 jours. Si l’âme de la créature est consentante et libre de rejoindre son corps, elle est ressuscitée avec 1 point de vie. <br> Ce sort neutralise aussi les poisons et soigne les maladies non magiques qui affectaient la cible au moment de sa mort. En revanche, il ne peut rien contre les malédictions et maladies magiques et autres effets similaires. S’ils ne sont pas éliminés avant l’incantation du sort, ils reprennent effet dès que la créature est ressuscitée. Ce sort ne permet pas de rappeler un mort-vivant à la vie. <br> Le sort referme les blessures mortelles, mais ne fait pas repousser les parties du corps. S’il lui manque des organes vitaux, comme son cœur ou sa tête, le sort échoue automatiquement. <br> La résurrection est éprouvante. La cible subit un malus de -4 aux jets d’attaque, jets de sauvegarde et tests de caractéristique. Chaque fois que la cible termine un repos long, le malus est réduit de 1 jusqu’à ce qu’il disparaisse complètement.";"Paladin"
"5";"Vague destructrice";"Évocation du 5e niveau";"1 action";"personnelle (rayon de 9 m)";"V";"instantanée";"Vous frappez le sol, ce qui crée une onde d’énergie divine émanant de votre position. Toute créature que vous désignez dans un rayon de 9 m de vous doit réussir un JS Constitution sous peine de subir 5d6 dégâts de tonnerre, ainsi que 5d6 dégâts radiants ou nécrotiques (selon votre choix) et de se retrouver à terre. En cas de réussite, elle ne subit que la moitié de ces dégâts et n’est pas projetée à terre.";"Paladin"
